{
  "id": "550e8400-e29b-41d4-a716-446655440000",
  "name": "architecture-diagram-v2.png",
  "mime_type": "image/png",
  "size": 524288,
  "path": "/documents/architecture/architecture-diagram-v2.png",
  "checksum": "sha256:a1b2c3d4e5f6a7b8c9d0e1f2a3b4c5d6e7f8a9b0",
  "source": "local-fs",
  "source_id": "fixture-file-001",
  "extensions": {},
  "created_at": "2026-01-15T10:30:00Z",
  "updated_at": "2026-01-15T10:30:00Z"
}
