{
  "id": "550e8400-e29b-41d4-a716-446655440002",
  "name": "quarterly-report.pdf",
  "mime_type": "application/pdf",
  "size": 245760,
  "path": "/documents/reports/quarterly-report.pdf",
  "checksum": "sha256:e3b0c44298fc1c149afbf4c8996fb924",
  "source": "test",
  "source_id": "test-file-001",
  "extensions": {
    "com.minio.connector": {
      "bucket": "documents",
      "etag": "abc123"
    }
  },
  "created_at": "2026-01-15T10:30:00Z",
  "updated_at": "2026-01-15T10:30:00Z"
}
